{
  "id": "singapore-passport",
  "name": {
    "en": "Singapore passport photo (ICA e-Services upload)",
    "zh": "\u65b0\u52a0\u5761\u62a4\u7167\u7167\u7247\uff08ICA \u7535\u5b50\u670d\u52a1\u4e0a\u4f20\uff09"
  },
  "category": "passport",
  "region": "SG",
  "issuer": "Immigration & Checkpoints Authority of Singapore",
  "photo": {
    "pixels": {
      "width": 400,
      "height": 514,
      "min_width": null,
      "max_width": null
    },
    "print_mm": {
      "width": null,
      "height": null
    },
    "dpi": null,
    "aspect": "400:514",
    "head_ratio": null,
    "background": [],
    "color": "color"
  },
  "file": {
    "formats": ["jpg", "heic", "heif", "png"],
    "min_kb": null,
    "max_kb": 8192
  },
  "notes": {
    "en": "ICA Photo Guidelines HTML (checked 2026-10-12). Verbatim: 400X514 pixels for e-Services; jpg, jpeg, heic, heif and png; Maximum file size 8MB. 35x45 mm and white background are not in the captured HTML. needs-review.",
    "zh": "ICA HTML\uff082026-10-12\uff09\u3002\u539f\u6587\uff1a400X514 pixels; jpg/jpeg/heic/heif/png; 8MB\u3002\u6293\u5230\u7684 HTML \u6ca1\u6709 35x45 mm \u4e0e\u767d\u5e95\u3002needs-review\u3002"
  },
  "sources": [{
    "url": "https://www.ica.gov.sg/photo-guidelines",
    "title": "ICA Singapore: Photo guidelines",
    "checked": "2026-10-12"
  }],
  "status": "needs-review"
}
