{
  "id": "uk-visa",
  "name": {
    "en": "UK visa / permission digital face photo",
    "zh": "\u82f1\u56fd\u7b7e\u8bc1\u6216\u8bb8\u53ef\u6570\u5b57\u9762\u90e8\u7167\u7247"
  },
  "category": "visa",
  "region": "GB",
  "issuer": "UK Visas and Immigration / GOV.UK",
  "photo": {
    "pixels": {
      "width": null,
      "height": null,
      "min_width": 600,
      "max_width": null,
      "min_height": 750
    },
    "print_mm": {
      "width": null,
      "height": null
    },
    "dpi": null,
    "aspect": "4:5",
    "head_ratio": null,
    "background": [],
    "color": "color"
  },
  "file": {
    "formats": ["jpg"],
    "min_kb": 50,
    "max_kb": 6144
  },
  "notes": {
    "en": "UKVI guidance (checked 2026-10-12). Verbatim: at least 600 pixels wide and 750 pixels tall; at least 50KB and no more than 6MB; a jpg or jpeg file; plain light-coloured background. Stored: min 600x750 px; JPG/JPEG; 50 KB-6 MB (6 MB recorded as 6144 KB; 1000 vs 1024 not stated). Light-coloured background is not a named hex, so background stays empty. Print millimetres, DPI and head ratio are not in that quote. Missing a named background keeps needs-review.",
    "zh": "UKVI \u6307\u5f15\uff082026-10-12 \u6838\u5bf9\uff09. \u539f\u6587: at least 600 pixels wide and 750 pixels tall; at least 50KB and no more than 6MB; a jpg or jpeg file; plain light-coloured background. \u53ea\u8bb0: 600x750; JPG/JPEG; 50 KB-6 MB. \u6d45\u8272\u80cc\u666f\u65e0\u8272\u503c. needs-review."
  },
  "sources": [{
    "url": "https://www.gov.uk/guidance/how-to-take-a-photo-for-a-visa-application-or-permission",
    "title": "GOV.UK: Take a photo of your face for a visa application or permission",
    "checked": "2026-10-12"
  }],
  "status": "needs-review"
}
