{
  "id": "cn-legal-professional",
  "name": {
    "en": "National Unified Legal Professional Qualification Examination registration photo",
    "zh": "\u56fd\u5bb6\u7edf\u4e00\u6cd5\u5f8b\u804c\u4e1a\u8d44\u683c\u8003\u8bd5\u62a5\u540d\u7167"
  },
  "category": "exam",
  "region": "CN",
  "issuer": "Ministry of Justice of the People's Republic of China",
  "photo": {
    "pixels": {
      "width": 413,
      "height": 626,
      "min_width": null,
      "max_width": null
    },
    "print_mm": {
      "width": null,
      "height": null
    },
    "dpi": null,
    "aspect": "413:626",
    "head_ratio": null,
    "background": ["#FFFFFF"],
    "color": "color"
  },
  "file": {
    "formats": [],
    "min_kb": null,
    "max_kb": null
  },
  "notes": {
    "en": "Ministry of Justice notice (checked 2026-10-12). Verbatim: 413px x 626px; colour; red, blue or white background. JPG, 40-100 KB and head about two-thirds are not in this quote. needs-review.",
    "zh": "\u53f8\u6cd5\u90e8\u516c\u544a\uff082026-10-12\uff09\u3002\u539f\u6587\uff1a\u5bbd413\u50cf\u7d20\u00d7\u9ad8626\u50cf\u7d20\uff1b\u5f69\u8272\uff1b\u7ea2\u3001\u84dd\u3001\u767d\u5e95\u8272\u5747\u53ef\u3002JPG\u300140-100KB \u4e0d\u5728\u672c\u539f\u6587\u3002needs-review\u3002"
  },
  "sources": [{
    "url": "https://www.moj.gov.cn/pub/sfbgwapp/zwgk/tzggApp/202606/t20260605_536064.html",
    "title": "Ministry of Justice: National Unified Legal Professional Qualification Examination notice",
    "checked": "2026-10-12"
  }],
  "status": "needs-review"
}
