{
  "id": "ntce",
  "name": {
    "en": "National Teacher Certificate Examination (NTCE) registration photo",
    "zh": "\u4e2d\u5c0f\u5b66\u6559\u5e08\u8d44\u683c\u8003\u8bd5\u62a5\u540d\u7167"
  },
  "category": "exam",
  "region": "CN",
  "issuer": "National Education Examinations Authority (NEEA) / NTCE",
  "photo": {
    "pixels": {
      "width": null,
      "height": null,
      "min_width": null,
      "max_width": null
    },
    "print_mm": {
      "width": null,
      "height": null
    },
    "dpi": null,
    "aspect": null,
    "head_ratio": null,
    "background": ["#FFFFFF"],
    "color": "color"
  },
  "file": {
    "formats": ["jpg"],
    "min_kb": null,
    "max_kb": 200
  },
  "notes": {
    "en": "NEEA NTCE page (checked 2026-10-12). Verbatim: bareheaded, front-facing, colour, white background, JPG/JPEG, not larger than 200K. Pixels are not in that quote. needs-review.",
    "zh": "NTCE \u56fd\u5bb6\u62a5\u540d\u9875\uff082026-10-12\uff09\u3002\u539f\u6587\uff1a\u514d\u51a0\u3001\u6b63\u9762\u3001\u5f69\u8272\u3001\u767d\u5e95\uff0cJPG/JPEG\u683c\u5f0f\uff0c\u4e0d\u5927\u4e8e200K\u3002\u65e0\u50cf\u7d20\u3002needs-review\u3002"
  },
  "sources": [{
    "url": "https://ntce.neea.edu.cn/xhtml1/folder/1507/1077-1.htm",
    "title": "NEEA NTCE: registration flow (photo upload)",
    "checked": "2026-10-12"
  }],
  "status": "needs-review"
}
