{
  "id": "hsk",
  "name": {
    "en": "HSK registration photo",
    "zh": "\u6c49\u8bed\u6c34\u5e73\u8003\u8bd5\u62a5\u540d\u7167"
  },
  "category": "exam",
  "region": "CN",
  "issuer": "Chinese Testing International (chinesetest.cn)",
  "photo": {
    "pixels": {
      "width": null,
      "height": null,
      "min_width": null,
      "max_width": null
    },
    "print_mm": {
      "width": null,
      "height": null
    },
    "dpi": null,
    "aspect": null,
    "head_ratio": null,
    "background": ["#FFFFFF"],
    "color": "either"
  },
  "file": {
    "formats": ["jpg"],
    "min_kb": null,
    "max_kb": 100
  },
  "notes": {
    "en": "Chinese Testing International notice dated 2013 (checked 2026-10-12). Verbatim: black-or-colour photo, white background preferred; JPG/JPEG; within 100KB; 2-cun ID photo. Stored: either; white #FFFFFF; jpg; max 100 KB. 2-cun is not converted to mm. Pixels and print mm are unknown. needs-review.",
    "zh": "\u6c49\u8003\u56fd\u9645 2013 \u5e74\u516c\u544a\uff082026-10-12\uff09\u3002\u539f\u6587\uff1a\u9ed1\u767d\u6216\u5f69\u8272\u3001\u767d\u5e95\u4e3a\u4f73\u3001JPG/JPEG\u3001100KB\u4ee5\u5185\u3001\u4e8c\u5bf8\u8bc1\u4ef6\u7167\u3002\u4e8c\u5bf8\u4e0d\u6362\u7b97\u6beb\u7c73\u3002needs-review\u3002"
  },
  "sources": [{
    "url": "https://admin.chinesetest.cn/gonewcontent.do?id=8546450",
    "title": "Chinese Testing International: 2013 HSK photo notice",
    "checked": "2026-10-12"
  }],
  "status": "needs-review"
}
