{
  "id": "pets",
  "name": {
    "en": "PETS (Public English Test System) registration photo",
    "zh": "\u5168\u56fd\u82f1\u8bed\u7b49\u7ea7\u8003\u8bd5\u62a5\u540d\u7167"
  },
  "category": "exam",
  "region": "CN",
  "issuer": "National Education Examinations Authority (NEEA) / PETS",
  "photo": {
    "pixels": {
      "width": null,
      "height": null,
      "min_width": null,
      "max_width": null
    },
    "print_mm": {
      "width": 33,
      "height": 48
    },
    "dpi": null,
    "aspect": "11:16",
    "head_ratio": {
      "min": 0.667,
      "max": 0.667
    },
    "background": ["#FFFFFF"],
    "color": "either"
  },
  "file": {
    "formats": [],
    "min_kb": 10,
    "max_kb": 50
  },
  "notes": {
    "en": "NEEA PETS notice (checked 2026-10-12). Verbatim: white or blue background, 33mm x 48mm, head 2/3 of photo height, file 10K-50K. Format and pixels are not in that quote. needs-review.",
    "zh": "PETS \u8003\u751f\u987b\u77e5\uff082026-10-12\uff09\u3002\u539f\u6587\uff1a\u80cc\u666f\u767d\u8272\u6216\u84dd\u8272\uff0c\u5bbd33mm\u3001\u9ad848mm\uff0c\u5934\u90e8\u5360\u7167\u7247\u957f\u5ea6\u76842/3\uff0c\u6587\u4ef610K-50K\u3002\u65e0\u683c\u5f0f\u4e0e\u50cf\u7d20\u3002needs-review\u3002"
  },
  "sources": [{
    "url": "https://pets.neea.edu.cn/xhtml1/folder/1507/1557-1.htm",
    "title": "NEEA PETS: candidate notice (photo upload)",
    "checked": "2026-10-12"
  }],
  "status": "needs-review"
}
