{
  "id": "schengen-visa",
  "name": {
    "en": "Schengen visa photo (German Foreign Office sample)",
    "zh": "\u7533\u6839\u7b7e\u8bc1\u7167\u7247\uff08\u5fb7\u56fd\u5916\u4ea4\u90e8\u6837\u672c\uff09"
  },
  "category": "visa",
  "region": "INTL",
  "issuer": "German Federal Foreign Office (sample)",
  "photo": {
    "pixels": {
      "width": null,
      "height": null,
      "min_width": null,
      "max_width": null
    },
    "print_mm": {
      "width": 35,
      "height": 45
    },
    "dpi": null,
    "aspect": "7:9",
    "head_ratio": {
      "min": 0.7,
      "max": 0.8
    },
    "background": [],
    "color": "either"
  },
  "file": {
    "formats": [],
    "min_kb": null,
    "max_kb": null
  },
  "notes": {
    "en": "German Foreign Office sample PDF (checked 2026-10-12). Verbatim: 45 mm; 35 mm; face 70-80 percent (32-36mm); one colour and bright, ideally neutral grey; black and white or in colour. Digital format and file size are not in that quote. needs-review.",
    "zh": "\u5fb7\u56fd\u5916\u4ea4\u90e8\u6837\u672c PDF\uff082026-10-12\uff09\u3002\u539f\u6587\uff1a35x45 mm\uff1b\u8138\u9ad8 70-80%\uff1b\u5355\u4e00\u6d45\u8272\u80cc\u666f\uff1b\u9ed1\u767d\u6216\u5f69\u8272\u3002\u65e0\u6570\u5b57\u683c\u5f0f\u4e0e\u5927\u5c0f\u3002needs-review\u3002"
  },
  "sources": [{
    "url": "https://digital.diplo.de/api/uploads/biometric_photos_instruction_0eb9a4741a.pdf",
    "title": "German Foreign Office sample: biometric photos instruction (35x45 mm)",
    "checked": "2026-10-12"
  }],
  "status": "needs-review"
}
